{
  "id": "demo-mysql",
  "database": {
    "driver": "mysql",
    "host": "127.0.0.1",
    "port": 3306,
    "name": "nxdom_test",
    "user": "root",
    "password": "12345678"
  },
  "auth": {
    "secret": "dev-only-secret-change-me",
    "sessionTtl": 7200,
    "table": "users",
    "identifier": "email",
    "passwordColumn": "password",
    "registerFillable": ["name"]
  },
  "storage": {
    "path": "../../storage/demo-mysql"
  }
}
